vague,priorite,pilier,titre_cible,format_snippet,sensible,statut
B,P2,01-أساسيات,افضل وقت لبدء متجر الكتروني في السنة,liste numérotée,non,reservoir
B,P2,01-أساسيات,التجارة الإلكترونية للمبتدئين خطوة بخطوة,liste numérotée,non,reservoir
B,P2,01-أساسيات,التجارة الإلكترونية مقابل العمل الحر أيهما أفضل,tableau comparatif,non,reservoir
B,P2,01-أساسيات,الفرق بين دروبشيبينغ والتجارة الإلكترونية,tableau comparatif,non,reservoir
B,P2,01-أساسيات,خطة عمل متجر الكتروني لاول 90 يوم,liste numérotée,non,reservoir
B,P2,01-أساسيات,كم رأس مال ابدأ به متجر دروبشيبينغ صغير,réponse directe,non,reservoir
B,P2,01-أساسيات,كيف اختبر فكرة منتج قبل البدء,liste numérotée,non,reservoir
B,P2,01-أساسيات,كيف اربح من التجارة الإلكترونية بدون موقع,liste numérotée,non,reservoir
B,P2,01-أساسيات,كيف اوازن بين الوظيفة والتجارة الإلكترونية,liste numérotée,non,reservoir
B,P2,01-أساسيات,ما الفرق بين المتجر العام والمتجر المتخصص,tableau comparatif,non,reservoir
B,P2,01-أساسيات,ما هي عيوب التجارة الإلكترونية الحقيقية,réponse directe,non,reservoir
B,P2,01-أساسيات,هل ابدأ بمنتج واحد ام عدة منتجات,réponse directe,non,reservoir
B,P2,01-أساسيات,هل التجارة الإلكترونية مربحة فعلا في 2026,réponse directe,non,reservoir
B,P2,01-أساسيات,هل يمكن البدء في التجارة الإلكترونية بدون خبرة تقنية,réponse directe,non,reservoir
B,P2,04-إعلانات,اعلانات تيك توك في العراق طريقة الدفع,liste numérotée,non,reservoir
B,P2,04-إعلانات,اعلانات فيسبوك في سوريا بدائل الدفع,liste numérotée,non,reservoir
B,P2,04-إعلانات,افضل المنتجات التي تنجح في اعلانات سناب الخليج,liste numérotée,non,reservoir
B,P2,04-إعلانات,افضل وقت لنشر فيديو منتج على تيك توك,liste numérotée,non,reservoir
B,P2,04-إعلانات,الفرق بين CBO و ABO في اعلانات فيسبوك,tableau comparatif,non,reservoir
B,P2,04-إعلانات,الفرق بين اعلانات تيك توك واعلانات فيسبوك,tableau comparatif,non,reservoir
B,P2,04-إعلانات,تكلفة اعلانات سناب شات في الخليج,liste numérotée,non,reservoir
B,P2,04-إعلانات,حكم إعلانات فيسبوك الممولة شرعا,liste numérotée,légal/fiscal,reservoir
B,P2,04-إعلانات,دفع اعلانات تيك توك عن طريق فوري,liste numérotée,non,reservoir
B,P2,04-إعلانات,دفع اعلانات فيسبوك عن طريق فوري في مصر,liste numérotée,non,reservoir
B,P2,04-إعلانات,سبب حظر حساب اعلانات فيسبوك وحلوله,liste numérotée,non,reservoir
B,P2,04-إعلانات,سياسة اعلانات فيسبوك للمنتجات الممنوعة,liste numérotée,non,reservoir
B,P2,04-إعلانات,كم ميزانية اختبار المنتج على فيسبوك,réponse directe,non,reservoir
B,P2,04-إعلانات,كيف اربح من تيك توك بدون اعلانات ممولة,liste numérotée,non,reservoir
B,P2,04-إعلانات,كيف استهدف جمهور دولة عربية محددة,liste numérotée,non,reservoir
B,P2,04-إعلانات,كيف اصنع ريلز لمنتج بدون ظهور,liste numérotée,non,reservoir
B,P2,04-إعلانات,كيف اصنع فيديو منتج يصبح فيروسي,liste numérotée,non,reservoir
B,P2,04-إعلانات,كيف اعيد استهداف الزوار retargeting,liste numérotée,non,reservoir
B,P2,04-إعلانات,كيف اكتب نص اعلاني يبيع copywriting,liste numérotée,non,reservoir
B,P2,04-إعلانات,لماذا لا تظهر اعلاناتي على فيسبوك,réponse directe,non,reservoir
B,P2,04-إعلانات,ما هو البكسل وكيف اركبه على شوبيفاي,réponse directe,non,reservoir
B,P2,04-إعلانات,مدير اعلانات تيك توك بالعربي شرح,liste numérotée,non,reservoir
B,P2,04-إعلانات,مقاس اعلانات سناب شات الصحيح,liste numérotée,non,reservoir
B,P2,04-إعلانات,مكتبة اعلانات تيك توك للبحث عن منتجات,liste numérotée,non,reservoir
B,P2,04-إعلانات,منصة ادارة اعلانات سناب شات شرح,liste numérotée,non,reservoir
B,P2,05-منصات وأدوات,افضل ثيمات شوبيفاي المجانية لمتجر منتج واحد,liste numérotée,non,reservoir
B,P2,05-منصات وأدوات,افضل منصات الطباعة عند الطلب للعرب,liste numérotée,non,reservoir
B,P2,05-منصات وأدوات,بديل شوبيفاي مجاني للمبتدئين,liste numérotée,non,reservoir
B,P2,05-منصات وأدوات,شوبيفاي في الأردن طريقة الدفع,liste numérotée,non,reservoir
B,P2,05-منصات وأدوات,شوبيفاي في العراق هل متاح,liste numérotée,non,reservoir
B,P2,05-منصات وأدوات,شوبيفاي في الكويت بوابات الدفع,liste numérotée,non,reservoir
B,P2,05-منصات وأدوات,شوبيفاي مقابل ووردبريس ووكومرس للعرب,tableau comparatif,non,reservoir
B,P2,05-منصات وأدوات,كم تكلفة اشتراك شوبيفاي الشهري الحقيقية,réponse directe,non,reservoir
B,P2,05-منصات وأدوات,كيف احسن سرعة متجر شوبيفاي,liste numérotée,non,reservoir
B,P2,05-منصات وأدوات,كيف اربط دومين عربي بمتجر شوبيفاي,liste numérotée,non,reservoir
B,P2,05-منصات وأدوات,ما هو البرينت اون ديماند وكيف ابدا,réponse directe,non,reservoir
B,P2,05-منصات وأدوات,متجر شوبيفاي جاهز للبيع,liste numérotée,non,reservoir
B,P2,07-الدفع,افضل بوابات الدفع للمتاجر العربية,liste numérotée,non,reservoir
B,P2,07-الدفع,الفرق بين الدفع عند الاستلام والدفع المسبق,tableau comparatif,non,reservoir
B,P2,07-الدفع,بدائل سترايب في الدول العربية,liste numérotée,non,reservoir
B,P2,07-الدفع,كيف استقبل المدفوعات الدولية بدون باي بال,liste numérotée,non,reservoir
B,P2,07-الدفع,كيف اقلل المرتجعات في الدفع عند الاستلام,liste numérotée,non,reservoir
B,P2,07-الدفع,لماذا يرفض العملاء الدفع عند الاستلام,réponse directe,non,reservoir
B,P2,07-الدفع,نسبة المرتجعات في الدفع عند الاستلام,liste numérotée,non,reservoir
B,P2,08-الشحن,افضل شركات الشحن الدولي للتجارة الإلكترونية,liste numérotée,transporteur,reservoir
B,P2,08-الشحن,كم يستغرق الشحن من الصين بالدروبشيبينغ,réponse directe,non,reservoir
B,P2,08-الشحن,كيف اتعامل مع تأخر الشحنات مع العملاء,liste numérotée,non,reservoir
B,P2,08-الشحن,كيف احسب تكلفة الشحن في متجري,liste numérotée,non,reservoir
B,P2,08-الشحن,كيف اختار وكيل شحن موثوق,liste numérotée,non,reservoir
B,P2,08-الشحن,مشاكل التوصيل في الدروبشيبينغ وحلولها,liste numérotée,non,reservoir
B,P2,10-تسويق وSEO,افضل استراتيجيات التسويق عبر البريد الالكتروني للمتاجر,liste numérotée,non,reservoir
B,P2,10-تسويق وSEO,افضل كلمات مفتاحية لمتجر الكتروني عربي,liste numérotée,non,reservoir
B,P2,10-تسويق وSEO,التسويق بالمؤثرين للمتاجر الصغيرة,liste numérotée,non,reservoir
B,P2,10-تسويق وSEO,كيف ابني صفحة انستغرام لمتجري,liste numérotée,non,reservoir
B,P2,10-تسويق وSEO,كيف اجلب زبائن لمتجري بدون اعلانات مدفوعة,liste numérotée,non,reservoir
B,P2,10-تسويق وSEO,كيف احسن ظهور متجري في جوجل,liste numérotée,non,reservoir
B,P2,10-تسويق وSEO,كيف اكتب وصف منتج يقنع بالشراء,liste numérotée,non,reservoir
B,P2,11-قانون وضرائب,الوثائق القانونية اللازمة لمتجر الكتروني,liste numérotée,légal/fiscal,reservoir
B,P2,11-قانون وضرائب,حقوق الصور والمحتوى في المتجر الالكتروني,liste numérotée,non,reservoir
B,P2,11-قانون وضرائب,حكم بيع منتجات غير موجودة في المخزون,liste numérotée,légal/fiscal,reservoir
B,P2,11-قانون وضرائب,ضرائب التجارة الإلكترونية في العراق,liste numérotée,non,reservoir
B,P2,11-قانون وضرائب,هل احتاج سجل تجاري للبيع اونلاين في الكويت,réponse directe,non,reservoir
B,P2,11-قانون وضرائب,هل ادفع ضرائب على ارباح المتجر,réponse directe,non,reservoir
B,P2,11-قانون وضرائب,هل الدروبشيبينغ قانوني في الدول العربية,réponse directe,légal/fiscal,reservoir
B,P2,12-توسع,استراتيجية التوسع من منتج واحد الى متجر عام,liste numérotée,non,reservoir
B,P2,12-توسع,كيف ابني فريق عمل لمتجري الناجح,liste numérotée,non,reservoir
B,P2,12-توسع,كيف اعيد استثمار ارباح المتجر للنمو,liste numérotée,non,reservoir
B,P2,12-توسع,كيف اوسع متجري الى اسواق جديدة,liste numérotée,non,reservoir
B,P2,12-توسع,متى ازيد ميزانية الاعلانات الرابحة,réponse directe,non,reservoir
B,P2,12-توسع,متى انتقل من الدروبشيبينغ الى تخزين المنتجات,réponse directe,non,reservoir
B,P2,13-تحويل,كيف ارفع معدل التحويل في متجري,liste numérotée,non,reservoir
B,P2,13-تحويل,كيف اصمم صفحة منتج احترافية,liste numérotée,non,reservoir
B,P2,13-تحويل,ما هي صفحة الهبوط landing page وكيف اصممها,réponse directe,non,reservoir
B,P2,14-ربح وتكاليف,التكاليف الخفية في التجارة الإلكترونية,liste numérotée,non,reservoir
B,P2,14-ربح وتكاليف,كم يربح اصحاب المتاجر الالكترونية شهريا,réponse directe,non,reservoir
B,P2,14-ربح وتكاليف,متى استرجع رأس مالي في الدروبشيبينغ,réponse directe,non,reservoir
B,P2,15-منتجات رقمية,الفرق بين بيع المنتجات الرقمية والفيزيائية,tableau comparatif,non,reservoir
B,P2,15-منتجات رقمية,كيف ابيع منتجات رقمية بدون مخزون,liste numérotée,non,reservoir
B,P2,16-أخطاء,اخطاء المبتدئين في اعلانات فيسبوك,liste numérotée,non,reservoir
B,P2,16-أخطاء,اخطاء تسعير المنتجات في المتجر,liste numérotée,non,reservoir
B,P2,16-أخطاء,اكبر الاخطاء التي تقتل المتاجر الجديدة,liste numérotée,non,reservoir
B,P2,16-أخطاء,لماذا يفشل 90% من متاجر الدروبشيبينغ,réponse directe,non,reservoir
B,P2,16-أخطاء,لماذا يهجر الزوار سلة الشراء,réponse directe,non,reservoir
B,P2,16-أخطاء,متى اوقف اعلان خاسر,réponse directe,non,reservoir
B,P2,17-قصص,قصص نجاح عرب في الدروبشيبينغ 2026,liste numérotée,non,reservoir
B,P2,19-حسب البلد (عربي),أفضل المنتجات الرابحة في السوق العراقي,liste numérotée,non,reservoir
B,P2,19-حسب البلد (عربي),أفضل بوابات الدفع للمتاجر في الكويت KNET,liste numérotée,non,reservoir
B,P2,19-حسب البلد (عربي),أفضل بوابات الدفع لمتجر سعودي,liste numérotée,non,reservoir
B,P2,19-حسب البلد (عربي),أفضل شركات التوصيل في العراق للمتاجر,liste numérotée,non,reservoir
B,P2,19-حسب البلد (عربي),البيع اونلاين في اليمن طرق عملية,liste numérotée,non,reservoir
B,P2,19-حسب البلد (عربي),التجارة الإلكترونية في الأردن دليل البداية,liste numérotée,non,reservoir
B,P2,19-حسب البلد (عربي),التجارة الإلكترونية في السودان والتحديات,liste numérotée,non,reservoir
B,P2,19-حسب البلد (عربي),التجارة الإلكترونية في العراق كيف تبدأ,liste numérotée,non,reservoir
B,P2,19-حسب البلد (عربي),التجارة الإلكترونية في سوريا وبدائل الدفع,liste numérotée,non,reservoir
B,P2,19-حسب البلد (عربي),التجارة الإلكترونية في عمان والمنتجات الرائجة,liste numérotée,non,reservoir
B,P2,19-حسب البلد (عربي),التجارة الإلكترونية في لبنان رغم الأزمة,liste numérotée,non,reservoir
B,P2,19-حسب البلد (عربي),التجارة الإلكترونية في موريتانيا للمبتدئين,liste numérotée,non,reservoir
B,P2,19-حسب البلد (عربي),بوابات الدفع المتاحة للمتاجر في تونس,liste numérotée,non,reservoir
B,P2,19-حسب البلد (عربي),بوابات الدفع للمتاجر في البحرين Benefit,liste numérotée,non,reservoir
B,P2,19-حسب البلد (عربي),تكلفة وتراخيص متجر الكتروني في الإمارات,liste numérotée,non,reservoir
B,P2,19-حسب البلد (عربي),دفع اعلانات فيسبوك عبر فوري في مصر,liste numérotée,non,reservoir
B,P2,19-حسب البلد (عربي),شركات الشحن والتوصيل في الأردن,liste numérotée,transporteur,reservoir
B,P2,19-حسب البلد (عربي),ضرائب وزكاة المتجر الإلكتروني في السعودية,liste numérotée,non,reservoir
B,P2,19-حسب البلد (عربي),كيف ابدأ تجارة الكترونية في ليبيا,liste numérotée,non,reservoir
B,P2,19-حسب البلد (عربي),كيف ابدأ متجر الكتروني في فلسطين,liste numérotée,non,reservoir
B,P2,19-حسب البلد (عربي),كيف ابدأ متجر الكتروني في قطر,liste numérotée,non,reservoir
B,P2,19-حسب البلد (عربي),كيف استقبل أرباح المتجر في المغرب بدون باي بال,liste numérotée,non,reservoir
B,P2,19-حسب البلد (عربي),مشاكل الدفع الإلكتروني في الجزائر وحلولها,liste numérotée,non,reservoir
B,P2,19-حسب البلد (عربي),هل احتاج رخصة للبيع اونلاين في الكويت,réponse directe,non,reservoir
C,P3,02-منتجات ونيشات,أدوات معرفة المنتج الرابح المجانية,liste numérotée,non,reservoir
C,P3,02-منتجات ونيشات,ادوات تجسس على متاجر المنافسين,liste numérotée,non,reservoir
C,P3,02-منتجات ونيشات,افضل نيش لمنتجات الاطفال دروبشيبينغ,liste numérotée,non,reservoir
C,P3,02-منتجات ونيشات,الفرق بين منتج موسمي ومنتج دائم,tableau comparatif,non,reservoir
C,P3,02-منتجات ونيشات,المنتج الرابح للسوق العراقي,liste numérotée,non,reservoir
C,P3,02-منتجات ونيشات,كيف اجد منتج رابح من تيك توك,liste numérotée,non,reservoir
C,P3,02-منتجات ونيشات,كيف اعرف الطلب على منتج في بلد معين,liste numérotée,non,reservoir
C,P3,02-منتجات ونيشات,كيف اعرف ان المنتج مشبع,liste numérotée,non,reservoir
C,P3,02-منتجات ونيشات,كيف اقيم هامش الربح قبل اختيار المنتج,liste numérotée,non,reservoir
C,P3,02-منتجات ونيشات,منتجات رابحة لرمضان والاعياد,liste numérotée,non,reservoir
C,P3,02-منتجات ونيشات,منتجات رابحة لفصل الصيف دروبشيبينغ,liste numérotée,non,reservoir
C,P3,02-منتجات ونيشات,منتجات رابحة للموسم الدراسي,liste numérotée,non,reservoir
C,P3,02-منتجات ونيشات,مواصفات المنتج الرابح في 2026,liste numérotée,non,reservoir
C,P3,02-منتجات ونيشات,نيش الادوات المنزلية الذكية,liste numérotée,non,reservoir
C,P3,02-منتجات ونيشات,نيش الاكسسوارات والمجوهرات اونلاين,liste numérotée,non,reservoir
C,P3,02-منتجات ونيشات,نيش المنتجات الدينية والاسلامية اونلاين,liste numérotée,non,reservoir
C,P3,02-منتجات ونيشات,نيش المنتجات الرياضية واللياقة دروبشيبينغ,liste numérotée,non,reservoir
C,P3,02-منتجات ونيشات,نيش مستلزمات الحيوانات الأليفة في الخليج,liste numérotée,non,reservoir
C,P3,02-منتجات ونيشات,نيش منتجات الالعاب والاطفال,liste numérotée,non,reservoir
C,P3,02-منتجات ونيشات,نيش منتجات التخييم والرحلات,liste numérotée,non,reservoir
C,P3,02-منتجات ونيشات,نيش منتجات الديكور المنزلي الرابحة,liste numérotée,non,reservoir
C,P3,02-منتجات ونيشات,نيش منتجات السيارات واكسسواراتها,liste numérotée,non,reservoir
C,P3,02-منتجات ونيشات,نيش منتجات الصحة واللياقة للنساء,liste numérotée,non,reservoir
C,P3,02-منتجات ونيشات,نيش منتجات العرسان وحفلات الزفاف,liste numérotée,non,reservoir
C,P3,02-منتجات ونيشات,نيش منتجات العناية بالبشرة للرجال,liste numérotée,non,reservoir
C,P3,02-منتجات ونيشات,نيش منتجات المطبخ المنزلي الرابحة,liste numérotée,non,reservoir
C,P3,03-موردون,افضل تطبيقات ربط الموردين بشوبيفاي,liste numérotée,non,reservoir
C,P3,03-موردون,افضل منصات الموردين للسوق الخليجي,liste numérotée,non,reservoir
C,P3,03-موردون,الفرق بين الوكيل والمورد في الدروبشيبينغ,tableau comparatif,non,reservoir
C,P3,03-موردون,بدائل علي اكسبريس للدروبشيبينغ,liste numérotée,non,reservoir
C,P3,03-موردون,كيف اتجنب المورد المحتال في الدروبشيبينغ,liste numérotée,non,reservoir
C,P3,03-موردون,كيف اتفاوض مع المورد الصيني,liste numérotée,non,reservoir
C,P3,03-موردون,كيف اطلب عينة من المورد قبل البيع,liste numérotée,non,reservoir
C,P3,03-موردون,موردين دروبشيبينغ في تركيا للعرب,liste numérotée,non,reservoir
C,P3,03-موردون,موردين محليين دروبشيبينغ في الخليج,liste numérotée,non,reservoir
C,P3,03-موردون,موردين منتجات رقمية للبيع,liste numérotée,non,reservoir
C,P3,16-أخطاء,اخطاء اختيار النيش الشائعة,liste numérotée,non,reservoir
C,P3,20-حسب البلد (شتات),التجارة الإلكترونية في ألمانيا للناطقين بالعربية,liste numérotée,non,reservoir
C,P3,20-حسب البلد (شتات),التجارة الإلكترونية في إسبانيا للعرب autónomo,liste numérotée,non,reservoir
C,P3,20-حسب البلد (شتات),التجارة الإلكترونية في كندا للمهاجرين العرب,liste numérotée,non,reservoir
C,P3,20-حسب البلد (شتات),التجارة الإلكترونية في هولندا ونظام iDEAL,liste numérotée,non,reservoir
C,P3,20-حسب البلد (شتات),التصريح الضريبي للتجارة الإلكترونية في فرنسا للعرب,liste numérotée,légal/fiscal,reservoir
C,P3,20-حسب البلد (شتات),دروبشيبينغ في استراليا بالعربية ABN,liste numérotée,non,reservoir
C,P3,20-حسب البلد (شتات),ضريبة Kleinunternehmer للدروبشيبينغ في ألمانيا,liste numérotée,légal/fiscal,reservoir
C,P3,20-حسب البلد (شتات),كيف ابدأ تجارة الكترونية في ايطاليا partita IVA,liste numérotée,non,reservoir
C,P3,20-حسب البلد (شتات),كيف ابدأ تجارة الكترونية في بلجيكا بالعربي,liste numérotée,non,reservoir
C,P3,20-حسب البلد (شتات),كيف ابدأ دروبشيبينغ في امريكا بالعربية LLC,liste numérotée,non,reservoir
C,P3,20-حسب البلد (شتات),كيف ابدأ متجر الكتروني في السويد بالعربي,liste numérotée,non,reservoir
C,P3,20-حسب البلد (شتات),كيف اسجل micro-entreprise لمتجر دروبشيبينغ,liste numérotée,non,reservoir
C,P3,20-حسب البلد (شتات),كيف اسجل متجر دروبشيبينغ في بريطانيا sole trader,liste numérotée,non,reservoir
